Student ID,Student First Name,Student Last Name,Program,Department,Year
1000001,Sean,Richmond,MS in Business Analytics (full time) - Dual,Department of Economics and Business,1
1000002,Dana,McPherson,MS in Business Analytics (full time) - Dual,Department of Economics and Business,1
1000003,Csongor,Barta,PhD in Economics - Dual,Department of Economics and Business,2
1000004,Hanna,Csatár,PhD in Cognitive Science – Dual,Department of Cognitive Science,3
1000005,Lyudmila,Vinogradova,MA in Economics - Dual,Department of Economics and Business,2
